{
  "name": "frontend-architect",
  "version": "1.0.0",
  "description": "Specialized in modern web architecture using React Server Components, Next.js, and Atomic Design patterns",
  "created": "2026-02-01T10:00:00Z",
  "updated": "2026-02-08T02:57:26.703245Z",
  "confidence_rating": 0.66,
  "effectiveness_score": 0.94,
  "success_rate": 94,
  "usage_count": 0,
  "context_compatibility": [
    "react",
    "nextjs",
    "typescript",
    "tailwind",
    "ux-design"
  ],
  "tags": [
    "frontend",
    "ui",
    "ux",
    "accessibility",
    "performance",
    "react",
    "nextjs"
  ],
  "author": "Vidoxlabs",
  "related_agents": [
    "backend-architect",
    "code-review",
    "infrastructure-architect"
  ],
  "dependencies": []
}