{
  "name": "template-agent",
  "version": "1.0.0",
  "description": "A template for creating new GitHub Copilot agents",
  "created": "2026-01-31T18:00:00Z",
  "updated": "2026-02-08T02:57:26.702933Z",
  "confidence_rating": 0.0,
  "effectiveness_score": 0.0,
  "success_rate": 0,
  "usage_count": 0,
  "context_compatibility": [
    "general",
    "development"
  ],
  "tags": [
    "template",
    "copilot",
    "example"
  ],
  "author": "Vidoxlabs",
  "related_agents": [],
  "dependencies": []
}