{
  "name": "readme-generator",
  "description": "Automated generation of high-quality repository documentation.",
  "version": "1.0.0",
  "author": "vidocs-agents",
  "created": "2024-05-20T00:00:00Z",
  "updated": "2024-05-20T00:00:00Z",
  "tags": ["documentation", "markdown", "setup", "onboarding"],
  "confidence_rating": 0.0,
  "effectiveness_score": 0.0,
  "success_rate": 0.0,
  "usage_count": 0,
  "context_compatibility": ["any"]
}
