{
  "name": "doc-sentinel-agent",
  "version": "1.0.0",
  "description": "Enforces consistency between documentation and implementation",
  "created": "2026-01-31T20:10:00Z",
  "updated": "2026-02-15T01:23:52.582156Z",
  "confidence_rating": 0.62,
  "effectiveness_score": 0.88,
  "success_rate": 90,
  "usage_count": 0,
  "context_compatibility": [
    "markdown",
    "documentation",
    "architecture-review",
    "configuration"
  ],
  "tags": [
    "docs",
    "consistency",
    "validation",
    "single-source-of-truth"
  ],
  "author": "Vidoxlabs",
  "related_agents": [
    "backend-architect",
    "infrastructure-architect",
    "code-review"
  ],
  "dependencies": []
}