{
  "name": "monorepo-manager",
  "version": "1.0.0",
  "description": "Maintains monorepo integrity, manages dependency graphs, and ensures efficient build pipelines",
  "created": "2026-02-01T10:10:00Z",
  "updated": "2026-02-08T02:57:26.703429Z",
  "confidence_rating": 0.63,
  "effectiveness_score": 0.9,
  "success_rate": 90,
  "usage_count": 0,
  "context_compatibility": [
    "turborepo",
    "pnpm",
    "javascript",
    "typescript",
    "monorepo",
    "build-systems"
  ],
  "tags": [
    "monorepo",
    "build-system",
    "architecture",
    "dependency-management",
    "devops"
  ],
  "author": "Vidoxlabs",
  "related_agents": [
    "backend-architect",
    "code-review",
    "infrastructure-architect"
  ],
  "dependencies": []
}