{
  "name": "vilabs-configurator",
  "version": "1.0.0",
  "description": "Unified onboarding agent that combines agent recruitment and IDE settings composition for existing or new codebases",
  "created": "2026-02-13T00:00:00Z",
  "updated": "2026-02-13T00:00:00Z",
  "confidence_rating": 0.0,
  "effectiveness_score": 0.0,
  "success_rate": 0,
  "usage_count": 0,
  "context_compatibility": [
    "general",
    "onboarding",
    "repository-analysis",
    "settings",
    "ide-configuration"
  ],
  "tags": [
    "onboarding",
    "orchestration",
    "settings",
    "recruitment",
    "bootstrap"
  ],
  "author": "Vidoxlabs",
  "related_agents": [
    "vilabs-recruiter",
    "vilabs-setting",
    "repository-introspector"
  ],
  "dependencies": []
}
