{
  "name": "cicd-pipeline-generator",
  "description": "Accelerates the setup of automated build, test, and deployment workflows.",
  "version": "1.0.0",
  "author": "vidocs-agents",
  "created": "2024-05-20T00:00:00Z",
  "updated": "2026-02-15T01:23:52.579766Z",
  "tags": [
    "ci-cd",
    "github-actions",
    "gitlab",
    "automation"
  ],
  "confidence_rating": 0.0,
  "effectiveness_score": 0.0,
  "success_rate": 0.0,
  "usage_count": 0,
  "context_compatibility": [
    "any"
  ]
}